{
  "drug": "Finerenone",
  "drug_lower": "finerenone",
  "slug": "finerenone_ckd",
  "condition": "CKD in type 2 diabetes",
  "comparator": "Placebo",
  "title": "Finerenone in diabetic kidney disease — illustrative two-trial analysis",
  "hero_h2": "Finerenone in type 2 diabetes with chronic kidney disease",
  "nyt_headline": "An illustrative comparison of FIDELIO-DKD and FIGARO-DKD",
  "date": "2026-10-22",
  "pico": {
    "pop": "Adults with type 2 diabetes and chronic kidney disease",
    "int": "Finerenone",
    "comp": "Placebo",
    "out": "Time to first cardiovascular death, nonfatal myocardial infarction, nonfatal stroke, or heart failure hospitalisation",
    "subgroup": "Subgroup effects have not been extracted for this demonstration"
  },
  "acronyms": {
    "NCT02540993": "FIDELIO-DKD",
    "NCT02545049": "FIGARO-DKD"
  },
  "trials": [
    { "nct": "NCT02540993", "name": "FIDELIO-DKD", "pmid": "33264825", "phase": "III", "year": 2020,
      "tE": 367, "tN": 2833, "cE": 420, "cN": 2841, "group": "Finerenone vs placebo",
      "publishedHR": 0.86, "hrLCI": 0.75, "hrUCI": 0.99, "reportedEffectType": "HR",
      "sourceUrl": "https://doi.org/10.1056/NEJMoa2025845",
      "allOutcomes": [{ "shortLabel": "CV composite", "title": "CV death, nonfatal MI/stroke, or HF hospitalisation", "type": "binary" }] },
    { "nct": "NCT02545049", "name": "FIGARO-DKD", "pmid": "34449181", "phase": "III", "year": 2021,
      "tE": 458, "tN": 3686, "cE": 519, "cN": 3666, "group": "Finerenone vs placebo",
      "publishedHR": 0.87, "hrLCI": 0.76, "hrUCI": 0.98, "reportedEffectType": "HR",
      "sourceUrl": "https://doi.org/10.1056/NEJMoa2110956",
      "allOutcomes": [{ "shortLabel": "CV composite", "title": "CV death, nonfatal MI/stroke, or HF hospitalisation", "type": "binary" }] }
  ]
}
